{
  "$schema": "https://json-schema.org/draft/2020-12/schema",
  "title": "Current canonical schema: shinobi world registry v38",
  "type": "object",
  "required": [
    "owner_id",
    "owner_type",
    "payload",
    "schema",
    "source_domain"
  ],
  "properties": {
    "owner_id": {
      "type": "string"
    },
    "owner_type": {
      "type": "string"
    },
    "payload": {
      "type": "object"
    },
    "schema": {
      "type": "string"
    },
    "source_domain": {
      "type": "string"
    }
  },
  "additionalProperties": true,
  "description": "Current canonical schema contract."
}
