{
  "owner_id": "world_economies_and_mission_markets",
  "owner_type": "world_registry",
  "payload": {
    "economies_and_mission_markets": {
      "last_settled_at": "SE-0061-06-01T07:00:00",
      "markets": [
        {
          "competition": [
            "faction_suna",
            "faction_kusa"
          ],
          "demand": [
            "escort",
            "investigation",
            "bandit_suppression",
            "border_reconnaissance",
            "protection",
            "capture"
          ],
          "id": "market_konoha_missions",
          "owner_id": "faction_konoha",
          "status": "active"
        },
        {
          "competition": [
            "faction_konoha"
          ],
          "demand": [
            "desert_escort",
            "oasis_security",
            "trade_route_protection",
            "poison_investigation"
          ],
          "id": "market_suna_missions",
          "owner_id": "faction_suna",
          "status": "funding_pressure"
        },
        {
          "competition": [
            "missing_nin",
            "private_security"
          ],
          "demand": [
            "shipping_security",
            "piracy_suppression",
            "island_reconnaissance",
            "smuggling"
          ],
          "id": "market_maritime_missions",
          "owner_id": "faction_kiri",
          "status": "fragmented"
        }
      ],
      "section": "economy_and_mission_market",
      "treasury_rule": "country, village, institution, force, and personal money remain separate",
      "finance": {
        "last_settled_at": "SE-0061-06-01T07:00:00",
        "next_due_at": "SE-0061-07-01T07:00:00",
        "currency_ref": "currency.ryo",
        "funding_exact": {
          "canon_hiruzen": "treasury.konoha",
          "canon_mei": "treasury.kiri",
          "canon_onoki": "treasury.iwa",
          "canon_raikage_a": "treasury.kumo",
          "canon_rasa": "treasury.suna",
          "faction.bounty_broker_network": "economy.contractors",
          "faction.fire_merchant_network": "economy.land_fire.private",
          "faction_ame": "treasury.ame",
          "faction_iron": "treasury.iron_samurai",
          "faction_iwa": "treasury.iwa",
          "faction_kiri": "treasury.kiri",
          "faction_konoha": "treasury.konoha",
          "faction_kumo": "treasury.kumo",
          "faction_kusa": "treasury.kusa",
          "faction_oto": "treasury.oto",
          "faction_suna": "treasury.suna",
          "faction_taki": "treasury.taki",
          "faction_yuga": "treasury.yuga",
          "house.tang": "house.tang",
          "institution.tanzaku.merchant_quarter": "economy.land_fire.private",
          "institution.waves.gato_enterprise": "economy.land_waves.private",
          "support.merchant.fumiko_takahara": "economy.land_fire.private"
        },
        "funding_prefixes": {
          "institution.konoha.": "treasury.konoha",
          "faction.konoha_": "treasury.konoha",
          "force.konoha.": "treasury.konoha",
          "institution.suna.": "treasury.suna",
          "faction.suna_": "treasury.suna",
          "force.suna.": "treasury.suna",
          "institution.kiri.": "treasury.kiri",
          "faction.kiri_": "treasury.kiri",
          "force.kiri.": "treasury.kiri",
          "institution.kumo.": "treasury.kumo",
          "faction.kumo_": "treasury.kumo",
          "force.kumo.": "treasury.kumo",
          "institution.iwa.": "treasury.iwa",
          "faction.iwa_": "treasury.iwa",
          "force.iwa.": "treasury.iwa",
          "institution.ame.": "treasury.ame",
          "faction.ame_": "treasury.ame",
          "force.ame.": "treasury.ame",
          "institution.kusa.": "treasury.kusa",
          "faction.kusa_": "treasury.kusa",
          "force.kusa.": "treasury.kusa",
          "institution.oto.": "treasury.oto",
          "faction.oto_": "treasury.oto",
          "force.oto.": "treasury.oto",
          "institution.taki.": "treasury.taki",
          "faction.taki_": "treasury.taki",
          "force.taki.": "treasury.taki",
          "institution.yuga.": "treasury.yuga",
          "faction.yuga_": "treasury.yuga",
          "force.yuga.": "treasury.yuga",
          "institution.iron.": "treasury.iron_samurai",
          "force.iron.": "treasury.iron_samurai",
          "institution.fire.": "treasury.land_fire",
          "faction.fire_": "treasury.land_fire"
        },
        "accounts": {
          "economy.land_fire.private": {
            "kind": "private_economy",
            "scope_ref": "country.fire"
          },
          "economy.land_wind.private": {
            "kind": "private_economy",
            "scope_ref": "country.wind"
          },
          "economy.land_water.private": {
            "kind": "private_economy",
            "scope_ref": "country.water"
          },
          "economy.land_lightning.private": {
            "kind": "private_economy",
            "scope_ref": "country.lightning"
          },
          "economy.land_earth.private": {
            "kind": "private_economy",
            "scope_ref": "country.earth"
          },
          "economy.land_rain.private": {
            "kind": "private_economy",
            "scope_ref": "country.rain"
          },
          "economy.land_grass.private": {
            "kind": "private_economy",
            "scope_ref": "country.grass"
          },
          "economy.land_rice.private": {
            "kind": "private_economy",
            "scope_ref": "country.rice"
          },
          "economy.land_waterfall.private": {
            "kind": "private_economy",
            "scope_ref": "country.waterfall"
          },
          "economy.land_hot_water.private": {
            "kind": "private_economy",
            "scope_ref": "country.hot_water"
          },
          "economy.land_iron.private": {
            "kind": "private_economy",
            "scope_ref": "country.iron"
          },
          "economy.land_waves.private": {
            "kind": "private_economy",
            "scope_ref": "country.waves"
          },
          "economy.contractors": {
            "kind": "contractor_economy",
            "scope_ref": "world.contractors"
          },
          "treasury.land_fire": {
            "kind": "country_treasury",
            "scope_ref": "country.fire",
            "monthly_outflow_reference_ryo": 7400000000
          },
          "treasury.land_wind": {
            "kind": "country_treasury",
            "scope_ref": "country.wind",
            "monthly_outflow_reference_ryo": 4120000000
          },
          "treasury.land_water": {
            "kind": "country_treasury",
            "scope_ref": "country.water",
            "monthly_outflow_reference_ryo": 5150000000
          },
          "treasury.land_lightning": {
            "kind": "country_treasury",
            "scope_ref": "country.lightning",
            "monthly_outflow_reference_ryo": 6050000000
          },
          "treasury.land_earth": {
            "kind": "country_treasury",
            "scope_ref": "country.earth",
            "monthly_outflow_reference_ryo": 5600000000
          },
          "treasury.land_rain": {
            "kind": "country_treasury",
            "scope_ref": "country.rain",
            "monthly_outflow_reference_ryo": 1080000000
          },
          "treasury.land_grass": {
            "kind": "country_treasury",
            "scope_ref": "country.grass",
            "monthly_outflow_reference_ryo": 810000000
          },
          "treasury.land_rice": {
            "kind": "country_treasury",
            "scope_ref": "country.rice",
            "monthly_outflow_reference_ryo": 740000000
          },
          "treasury.land_waterfall": {
            "kind": "country_treasury",
            "scope_ref": "country.waterfall",
            "monthly_outflow_reference_ryo": 650000000
          },
          "treasury.land_hot_water": {
            "kind": "country_treasury",
            "scope_ref": "country.hot_water",
            "monthly_outflow_reference_ryo": 595000000
          },
          "treasury.land_iron": {
            "kind": "country_treasury",
            "scope_ref": "country.iron",
            "monthly_outflow_reference_ryo": 2300000000
          },
          "treasury.land_waves": {
            "kind": "country_treasury",
            "scope_ref": "country.waves",
            "monthly_outflow_reference_ryo": 320000000
          },
          "treasury.konoha": {
            "kind": "village_treasury",
            "scope_ref": "faction_konoha",
            "monthly_outflow_reference_ryo": 1050180000
          },
          "treasury.suna": {
            "kind": "village_treasury",
            "scope_ref": "faction_suna",
            "monthly_outflow_reference_ryo": 520000000
          },
          "treasury.kiri": {
            "kind": "village_treasury",
            "scope_ref": "faction_kiri",
            "monthly_outflow_reference_ryo": 780000000
          },
          "treasury.kumo": {
            "kind": "village_treasury",
            "scope_ref": "faction_kumo",
            "monthly_outflow_reference_ryo": 950000000
          },
          "treasury.iwa": {
            "kind": "village_treasury",
            "scope_ref": "faction_iwa",
            "monthly_outflow_reference_ryo": 950000000
          },
          "treasury.ame": {
            "kind": "village_treasury",
            "scope_ref": "faction_ame",
            "monthly_outflow_reference_ryo": 160000000
          },
          "treasury.kusa": {
            "kind": "village_treasury",
            "scope_ref": "faction_kusa",
            "monthly_outflow_reference_ryo": 120000000
          },
          "treasury.oto": {
            "kind": "village_treasury",
            "scope_ref": "faction_oto",
            "monthly_outflow_reference_ryo": 100000000
          },
          "treasury.taki": {
            "kind": "village_treasury",